{
  "body": {
    "digest": "sha256:36d50665160e988ae77aa43d8feea79dad1efc477c4546a445d6bf5b0f1267e8",
    "encoding": "utf-8",
    "path": "library/review-bodies/7e7508f9-6982-5247-8301-85b530a5665c.md"
  },
  "candidate_snapshot": {
    "content": {
      "format": "m1_published_markdown_utf8",
      "text": "---\nartifact_id: \"urn:uuid:f1824e5e-bdc3-584b-a983-98335dbf1408\"\nentry_id: \"urn:uuid:fc4b66c5-886f-5388-a98b-261d1162e454\"\nsource_path: \"玩家手册2024/术语汇编/危害.htm\"\nnavigation_paths:\n  - \"玩家手册2024/附录C：术语汇编/危害\"\nsource_sha256: \"sha256:bffc4b34af8e03e0fc9a3b98e1df04d0cdff833d26b9815181e8e4d13f7db128\"\ndetected_encoding: \"gb18030\"\npublisher_profile: \"m1c3.obsidian-baseline@0.1.0\"\npublisher_release: \"baseline\"\npublisher_note_path: \"Notes/玩家手册2024/附录C：术语汇编/危害.md\"\n---\n# 危害\n\n<a id=\"Hazard\"></a>\n### 危害 Hazard\n\n危害是一种与环境有关的危险。另见“**燃烧**”、“**脱水**”、“**坠落**”、“**饥饿**”与“**窒息**”。\n\n<a id=\"Burning\"></a>\n### 燃烧 Burning【危害】\n\n燃烧中的生物或物件在其每个回合开始时受到1d4火焰伤害。以一个动作，你可以在地上打滚来熄灭你身上的火焰，并因此陷入倒地状态。\n燃烧的火焰同样也会在被浇灭、淹灭、扑灭时消失。\n\n<a id=\"Dehydration\"></a>\n### 脱水 Dehydration【危害】\n\n生物每天需要摄入一定量的水分，其需求量由体型决定，如下方每日水分需求表所示。若生物在一天中饮下的水分低于需求量的一半，其在本日结束时会获得1级力竭等级。\n因脱水获得的力竭等级，在生物饮下完整一日需求量的水分前无法被移除。另见“**力竭**”。\n**每日水分需求Water Needs per Day**\n\n| **体型** | **水** |  | **体型** | **水** |\n| --- | --- | --- | --- | --- |\n| 微型 | 1/4加仑 |  | 大型 | 4加仑 |\n| 小型 | 1加仑 |  | 巨型 | 16加仑 |\n| 中型 | 1加仑 |  | 超巨型 | 64加仑 |\n\n<a id=\"Falling\"></a>\n### 坠落 Falling【危害】\n\n坠落结束时，坠落生物会基于其坠落的距离受到钝击伤害：其每坠落10尺距离，就会受到1d6点钝击伤害（至多20d6）。当生物着地时，除非它将坠落伤害全数避免，不然它还会因此陷入倒地状态。\n生物坠入水中（或者别的什么液体中）时，其可以用反应进行一次DC15的力量（运动）或敏捷（特技）检定使自己以头先触水或以脚先触水。若检定成功，该生物所受的、由此次坠落导致的所有伤害将减半。\n\n<a id=\"Malnutrition\"></a>\n### 饥饿 Malnutrition【危害】\n\n生物每天需要摄入一定量的食物，其需求量由体型决定，如下方每日食物需求表所示。若生物在一天中吃下的食物低于这个量的一半，其在本日结束时必须通过一次DC10的体质豁免，否则将会获得1级力竭等级。而连续五天什么也不吃的生物会在第五天结束时自动获得1层额外的力竭等级，在这之后若继续什么也不吃，其每天结束时都将会获得1层额外的力竭等级。\n因饥饿获得的力竭等级，在生物吃下完整一日需求量的食物前无法被移除。另见“**力竭**”。\n**每日食物需求Food Needs per Day**\n\n| **体型** | **食物** |  | **体型** | **食物** |\n| --- | --- | --- | --- | --- |\n| 微型 | 1/4磅 |  | 大型 | 4磅 |\n| 小型 | 1磅 |  | 巨型 | 16磅 |\n| 中型 | 1磅 |  | 超巨型 | 64磅 |\n\n<a id=\"Suffocation\"></a>\n### 窒息 Suffocation【危害】\n\n生物可以屏息至多1+其体质调整值分钟（至少30秒），然后窒息开始。若一个生物的屏息时间殆尽或呼吸受阻，它将在自己的每个回合结束时获得1级力竭等级。当生物重新可以呼吸时，所有因窒息而获得的力竭等级都会被移除。\n"
    },
    "coverage": {
      "basis": "whole_note_utf8",
      "complete_entry": true,
      "end": 3566,
      "start": 0
    },
    "evidence_ids": [
      "urn:uuid:4e111ddd-1bf7-56de-94d3-6d6a7fb46e3f"
    ],
    "id": "urn:uuid:7e7508f9-6982-5247-8301-85b530a5665c",
    "kind": "shared_rule_entry",
    "source_entry_id": "urn:uuid:fc4b66c5-886f-5388-a98b-261d1162e454",
    "title": "危害"
  },
  "dependency_ids": [],
  "full_fidelity": "not_claimed",
  "id": "urn:uuid:7e7508f9-6982-5247-8301-85b530a5665c",
  "language": "zh-Hans",
  "module": "common",
  "review_record_id": "urn:uuid:47bfe560-f7e9-5f1e-8494-e56845d58299",
  "review_status": "in_review",
  "rules_context_id": "urn:uuid:cff6ac89-cab7-506f-bd7a-d5f2a1d0ebc2",
  "schema": "m2.rule-review-subject@0.1.0",
  "source_binding": {
    "artifact_id": "urn:uuid:f1824e5e-bdc3-584b-a983-98335dbf1408",
    "derived_evidence_id": null,
    "derived_note_utf8_range": {
      "end": 3566,
      "start": 0
    },
    "entry_id": "urn:uuid:fc4b66c5-886f-5388-a98b-261d1162e454",
    "fragment_id": "urn:uuid:d17a3815-3284-51a1-bbcb-057ce834a429",
    "mapping_id": "urn:uuid:a9215f4d-6094-5b6f-9377-6a9b33bc8e97"
  },
  "subject_kind": "shared_reference",
  "title": "危害",
  "uncompiled_semantics_retained": true
}
