{
  "body": {
    "digest": "sha256:32407096ed10d9d29457229332f0ca24e7937ebc4d3bb56e44716967c03d2571",
    "encoding": "utf-8",
    "path": "library/review-bodies/2e1f2c9a-26b2-563b-b713-4ffca1e85a67.md"
  },
  "candidate_snapshot": {
    "critical_fields": {
      "attack_bonus": 8,
      "damage": 14,
      "damage_dice": "2d8+5",
      "reach_ft": 10,
      "type": "thunder"
    },
    "editorial_explanation": "按本卡攻击，不把火元素攻击加值借来。",
    "extensions": {
      "lorebuddy.dnd2024": {
        "source_parameter_bindings": [
          {
            "extraction_id": "urn:uuid:ba5f6256-9b41-5ec8-9a33-8a2104ab2669",
            "json_pointer": "/critical_fields/attack_bonus"
          },
          {
            "extraction_id": "urn:uuid:53c05379-ec56-55c8-8168-dd197e0d831f",
            "json_pointer": "/critical_fields/reach_ft"
          },
          {
            "extraction_id": "urn:uuid:1ee01a0b-a8ec-5462-96cb-36be11a8d2be",
            "json_pointer": "/critical_fields/damage"
          },
          {
            "extraction_id": "urn:uuid:bc8679fd-fe7e-5c0e-b352-ec3170d80f7a",
            "json_pointer": "/critical_fields/damage_dice"
          },
          {
            "extraction_id": "urn:uuid:a16787eb-10c0-5429-9845-fdcc9b3ee828",
            "json_pointer": "/critical_fields/type"
          }
        ]
      }
    },
    "field_binding": {
      "adopted_decisions": [],
      "local_evidence": "A.ABILITY.3",
      "meaning": "source_bound_candidate_with_explicit_editorial_overrides_not_verbatim",
      "pointer": "/critical_fields"
    },
    "id": "urn:uuid:2e1f2c9a-26b2-563b-b713-4ffca1e85a67",
    "kind": "动作Actions",
    "mechanics": {
      "clauses": {
        "attack_bonus": 8,
        "damage": 14,
        "damage_dice": "2d8+5",
        "reach_ft": 10,
        "type": "thunder"
      },
      "damage": {
        "amount": {
          "dice": "2d8+5",
          "printed_fixed": 14,
          "selection": "use_scene_amount_mode; recorded_dice_must_not_be_rerolled"
        },
        "damage_type": "thunder",
        "expression_id": "urn:uuid:211ac4bb-d78b-51fc-8d52-04328f80e8f6",
        "linked_reduction_from_damage_taken": false,
        "other_effects": [],
        "save_success": null,
        "trigger": "hit"
      },
      "dependencies": [],
      "kind": "source_bound_candidate",
      "structured_coverage": "critical_clauses_and_complete_verbatim; remaining_semantics_uncompiled"
    },
    "owner_id": "urn:uuid:54f1247d-83b4-5942-8249-db0365d3c804",
    "required_evidence": [],
    "review_status": "candidate",
    "source_evidence_id": "urn:uuid:9f4c5666-f6e4-59fb-81ca-d9be65e8026e",
    "title": "雷鸣猛击",
    "verbatim_evidence": "A.ABILITY.3",
    "verbatim_text": " **雷鸣猛击Thunderous Slam。***近战攻击检定：*+8，触及10尺。*命中：*14（2d8+5）雷鸣伤害。\n"
  },
  "dependency_ids": [],
  "full_fidelity": "not_claimed",
  "id": "urn:uuid:2e1f2c9a-26b2-563b-b713-4ffca1e85a67",
  "language": "zh-Hans",
  "module": "creatures",
  "review_record_id": "urn:uuid:3ff2fc57-446a-54c2-8ada-3b44f759c4cb",
  "review_status": "in_review",
  "rules_context_id": "urn:uuid:cff6ac89-cab7-506f-bd7a-d5f2a1d0ebc2",
  "schema": "m2.rule-review-subject@0.1.0",
  "source_binding": {
    "artifact_id": "urn:uuid:f1824e5e-bdc3-584b-a983-98335dbf1408",
    "derived_evidence_id": "urn:uuid:9f4c5666-f6e4-59fb-81ca-d9be65e8026e",
    "derived_note_utf8_range": {
      "end": 3450,
      "start": 3333
    },
    "entry_id": "urn:uuid:2cc417f9-b3ff-5e61-b655-2653f61642d2",
    "fragment_id": "urn:uuid:8327c556-e357-5aa1-8db1-9daa6cb59898",
    "mapping_id": "urn:uuid:c8be1321-c4c1-5f9e-aa78-4411f9718000"
  },
  "subject_kind": "ability",
  "title": "雷鸣猛击",
  "uncompiled_semantics_retained": true
}
