{
  "body": {
    "digest": "sha256:bb7b8ebf7bcbb0f26b87e95d19a6eb24802f5d43ddaca8755b9806a5044cc09b",
    "encoding": "utf-8",
    "path": "library/review-bodies/ee7559b0-7859-56d2-abcf-a0d14993bcfc.md"
  },
  "candidate_snapshot": {
    "critical_fields": {
      "dc": 13,
      "emerge_ft": 5,
      "ends": [
        "body_hp_zero",
        "source_bonus_action"
      ],
      "immunity_scope": "this_ghost",
      "post_end_or_success_immunity_hours": 24,
      "range_ft": 5,
      "recharge": [
        6
      ],
      "retain": "own_game_statistics",
      "save": "charisma",
      "take_from_target": [
        "speed",
        "strength_modifier",
        "dexterity_modifier",
        "constitution_modifier"
      ],
      "target": "visible_humanoid",
      "target_incapacitated": true,
      "targeting_exception": "effects_specifically_targeting_undead"
    },
    "editorial_explanation": "不继承目标整卡或职业；宿主归0是结束条件，不推出幽魂自身同时死亡。",
    "extensions": {
      "lorebuddy.dnd2024": {
        "source_parameter_bindings": [
          {
            "extraction_id": "urn:uuid:6b33f3f6-6ab4-5713-9d14-912725bfc5dc",
            "json_pointer": "/critical_fields/save"
          },
          {
            "extraction_id": "urn:uuid:4a1b3f3f-7a29-56b5-8620-7b8c8ae858bd",
            "json_pointer": "/critical_fields/dc"
          },
          {
            "extraction_id": "urn:uuid:188bb67c-deb4-5a15-9c47-797379f290b3",
            "json_pointer": "/critical_fields/recharge/0"
          },
          {
            "extraction_id": "urn:uuid:87c3ce22-3f11-51f7-9942-ed5947ff5acf",
            "json_pointer": "/critical_fields/range_ft"
          },
          {
            "extraction_id": "urn:uuid:3b4af610-8f9f-5c2d-9dec-a5b9f8339d83",
            "json_pointer": "/critical_fields/target"
          },
          {
            "extraction_id": "urn:uuid:61a0d3bc-4482-5abb-972b-e4166097d507",
            "json_pointer": "/critical_fields/target_incapacitated"
          },
          {
            "extraction_id": "urn:uuid:bb0cce24-2a90-532c-a8c4-dfd5ff7815ac",
            "json_pointer": "/critical_fields/retain"
          },
          {
            "extraction_id": "urn:uuid:a12b11c5-7736-5cb0-88f6-2b1d91260cfd",
            "json_pointer": "/critical_fields/take_from_target/0"
          },
          {
            "extraction_id": "urn:uuid:88c7db00-94d2-53d9-8db0-7e2188346b79",
            "json_pointer": "/critical_fields/take_from_target/1"
          },
          {
            "extraction_id": "urn:uuid:3d756247-3461-50dd-8dea-37dac723e7a2",
            "json_pointer": "/critical_fields/take_from_target/2"
          },
          {
            "extraction_id": "urn:uuid:854eb05e-b540-5763-a947-4f14e673fabd",
            "json_pointer": "/critical_fields/take_from_target/3"
          },
          {
            "extraction_id": "urn:uuid:8bfd29b1-f25b-54a8-b43f-dd821bed7c79",
            "json_pointer": "/critical_fields/targeting_exception"
          },
          {
            "extraction_id": "urn:uuid:4f41ea84-f75e-5643-9ac5-81b691fa4f65",
            "json_pointer": "/critical_fields/ends/0"
          },
          {
            "extraction_id": "urn:uuid:80f32326-1c40-53e1-89f7-b599050e909d",
            "json_pointer": "/critical_fields/ends/1"
          },
          {
            "extraction_id": "urn:uuid:f8f7f33e-7648-51f3-9c30-6ffab0465a79",
            "json_pointer": "/critical_fields/emerge_ft"
          },
          {
            "extraction_id": "urn:uuid:7bfdee85-67a3-5798-8d26-54fc5a07970c",
            "json_pointer": "/critical_fields/post_end_or_success_immunity_hours"
          },
          {
            "extraction_id": "urn:uuid:6c4cf69e-d32b-5cf0-b0ec-791a2e67af08",
            "json_pointer": "/critical_fields/immunity_scope"
          }
        ]
      }
    },
    "field_binding": {
      "adopted_decisions": [],
      "pointer": "/critical_fields",
      "source_evidence": "G25.ABILITY.7"
    },
    "id": "urn:uuid:ee7559b0-7859-56d2-abcf-a0d14993bcfc",
    "kind": "动作Actions",
    "mechanics": {
      "clauses": {
        "dc": 13,
        "emerge_ft": 5,
        "ends": [
          "body_hp_zero",
          "source_bonus_action"
        ],
        "immunity_scope": "this_ghost",
        "post_end_or_success_immunity_hours": 24,
        "range_ft": 5,
        "recharge": [
          6
        ],
        "retain": "own_game_statistics",
        "save": "charisma",
        "take_from_target": [
          "speed",
          "strength_modifier",
          "dexterity_modifier",
          "constitution_modifier"
        ],
        "target": "visible_humanoid",
        "target_incapacitated": true,
        "targeting_exception": "effects_specifically_targeting_undead"
      },
      "dependencies": [
        "urn:uuid:9809bb64-da00-54a8-9512-ca442fc5befb",
        "urn:uuid:9809bb64-da00-54a8-9512-ca442fc5befb"
      ],
      "kind": "source_bound_candidate",
      "structured_coverage": "critical_clauses_plus_complete_verbatim; not_every_semantic_clause_compiled"
    },
    "owner_id": "urn:uuid:d033fa7e-4270-5b0d-abe8-dadd9d5123bc",
    "required_evidence": [
      "P.INCAP",
      "P.CONDITION"
    ],
    "review_status": "candidate",
    "source_evidence_id": "urn:uuid:e823d2f7-ff17-59a1-bc25-3c0ff7233817",
    "title": "附身",
    "verbatim_evidence": "G25.ABILITY.7",
    "verbatim_text": " **附身Possession（充能6）。***魅力豁免检定：*DC13，单一5尺内幽魂可见的类人生物。 *失败：*目标被幽魂附身。幽魂消失，目标陷入失能 状态并失去对身体的控制。现在由幽魂控制身体，但目标仍然保留自我意识。幽魂不能成为任意攻击、法术或其他效应的目标，针对亡灵的效应除外。幽魂仍然保留自己的游戏数据，但是使用附身目标的速度，以及力量、敏捷与体质调整值。\n附身持续至身体的生命值降至0，或在幽魂以附赠动作解除附身时结束。附身结束时，幽魂会出现在目标5尺内一处未占据空间，且目标在24小时内免疫此幽魂的附身。\n *成功：*目标在接下来24小时内免疫幽魂的附身。\n"
  },
  "dependency_ids": [
    "urn:uuid:9809bb64-da00-54a8-9512-ca442fc5befb"
  ],
  "full_fidelity": "not_claimed",
  "id": "urn:uuid:ee7559b0-7859-56d2-abcf-a0d14993bcfc",
  "language": "zh-Hans",
  "module": "creatures",
  "review_record_id": "urn:uuid:9e3e36e0-6c9c-5741-aedd-3edd140cc677",
  "review_status": "in_review",
  "rules_context_id": "urn:uuid:cff6ac89-cab7-506f-bd7a-d5f2a1d0ebc2",
  "schema": "m2.rule-review-subject@0.1.0",
  "source_binding": {
    "artifact_id": "urn:uuid:f1824e5e-bdc3-584b-a983-98335dbf1408",
    "derived_evidence_id": "urn:uuid:e823d2f7-ff17-59a1-bc25-3c0ff7233817",
    "derived_note_utf8_range": {
      "end": 4334,
      "start": 3551
    },
    "entry_id": "urn:uuid:b1a26be8-f173-5e7c-a9e8-1253c0018d9d",
    "fragment_id": "urn:uuid:b32518f2-acd4-5874-acf6-2482d95a72d4",
    "mapping_id": "urn:uuid:d142700e-702e-5bff-9bcd-1020553eb86e"
  },
  "subject_kind": "ability",
  "title": "附身",
  "uncompiled_semantics_retained": true
}
